{
  "envelope_version": "1.0.0",
  "source_id": "blue_moon",
  "idempotency_key": "blue_moon|GET|urlsha256:aaaaaaaaaaaaaaaaaaaaaaaaaaaaaaaaaaaaaaaaaaaaaaaaaaaaaaaaaaaaaaaa",
  "payload_meta": {
    "mime_type": "application/json",
    "size_bytes": 0,
    "checksum": { "sha256": "0000000000000000000000000000000000000000000000000000000000000000" }
  },
  "content": { "schema_hint": "wix.calendar.events.v1" },
  "request": {
    "url": "https://google-calendar.galilcloud.wixapps.net/_api/getEvents?compId=comp-kurk0gts&instance=Cvx_9zA6zBPvynb5y3Ufq9ti1OwqSvCBaRhAgM9XwtA.eyJpbnN0YW5jZUlkIjoiMDg2NDdkMmEtMmViMC00MzgwLWJmZGItNzA2ZGUzMTQ0ZjE0IiwiYXBwRGVmSWQiOiIxMjlhY2I0NC0yYzhhLTgzMTQtZmJjOC03M2Q1Yjk3M2E4OGYiLCJtZXRhU2l0ZUlkIjoiYjcwNTNhNmYtZDNiZC00Y2Y3LTk1MjUtMDRhYTdhZGZjNDc1Iiwic2lnbkRhdGUiOiIyMDIzLTExLTA3VDA3OjAyOjIzLjgxOFoiLCJkZW1vTW9kZSI6ZmFsc2UsImFpZCI6ImI1ZDQ1NDEwLTQ3NjktNGMwYS04MGE0LTdjYTNiNjBjMmI3NSIsImJpVG9rZW4iOiJiZjYxNDc0NS1mZDBkLTBmNzctMmFmZS03NGM3OTljYjhiNjEiLCJzaXRlT3duZXJJZCI6ImM0Mzc5Nzk2LWE5YzUtNDVkYi05MGIxLTE2OGZhZTQ0MTQ2NiJ9"
  },
  "timing": { "fetched_at": "2025-08-11T00:00:00Z" },
  "legal": { "license_id": "terms-unknown" },
  "geo_hint": { "crs": "EPSG:4326", "city_code": "sea-us" },
  "trace": { "attempt": 1 }
}

